tweet_id,author_id,handle,created_at,found_at,goalie_id,goalie_name,text
1380257557055410179,111182379,BComptonNHL,2021-04-08 04:33 PM,2021-04-08 04:59 PM,8479394,Carter Hart,Carter Hart starts tonight. #Flyers #Isles
1380257368928350215,174728134,charlieo_conn,2021-04-08 04:32 PM,2021-04-08 04:59 PM,8479394,Carter Hart,AV: Hart starts tonight. Hagg comes in for Myers.
1380262304739024897,20950481,NBCSEdgeHK,2021-04-08 04:52 PM,2021-04-08 04:59 PM,8479394,Carter Hart,Carter Hart will start Thursday vs. Islanders https://t.co/frUuiegSrY
1380257451522539529,812371848151252993,JameyBaskow,2021-04-08 04:33 PM,2021-04-08 04:59 PM,8479394,Carter Hart,Carter Hart starts tonight folks
1380257583127273479,128120536,waynefish1,2021-04-08 04:33 PM,2021-04-08 04:59 PM,8479394,Carter Hart,Hart starting tonight. Hagg in for Myers.
1380262173507739654,3925722439,FantasyAlarmNHL,2021-04-08 04:52 PM,2021-04-08 04:59 PM,8479394,Carter Hart,Carter Hart will be between the pipes on Thursday night versus the New York Islanders. Fantasy Analysis Here: https://t.co/nHcsPUG3OG
