tweet_id,author_id,handle,created_at,found_at,goalie_id,goalie_name,text
1381990925367402499,325813119,SaadYousuf126,2021-04-13 11:21 AM,2021-04-13 11:28 AM,8471418,Anton Khudobin,Anton Khudobin first goalie off the ice. This would be his fourth consecutive start.
1381990190357577730,316061347,MDeFranks,2021-04-13 11:18 AM,2021-04-13 11:28 AM,8471418,Anton Khudobin,Anton Khudobin is the first goalie off the ice for the Stars this morning.
1382008723783159812,325813119,SaadYousuf126,2021-04-13 12:32 PM,2021-04-13 12:38 PM,8471418,Anton Khudobin,Rick Bowness confirms Anton Khudobin will start his fourth consecutive game tonight.
1382008839189454852,2338746500,BruceLeVinePuck,2021-04-13 12:32 PM,2021-04-13 12:38 PM,8471418,Anton Khudobin,Anton Khudobin will start for the Stars tonight says Rick Bowness.
1382008735959281675,41511084,taylordbaird,2021-04-13 12:32 PM,2021-04-13 12:38 PM,8471418,Anton Khudobin,Anton Khudobin is the confirmed starter tonight per head coach Rick Bowness.
