tweet_id,author_id,handle,created_at,found_at,goalie_id,goalie_name,text
1392894640798453765,174860999,saraorlesky,2021-05-13 01:28 PM,2021-05-13 01:58 PM,8476945,Connor Hellebuyck,Connor Hellebuyck starts vs #Leafs on Friday. #NHLJets @TSN_Edge #TSN
1392898074083610627,20950481,NBCSEdgeHK,2021-05-13 01:42 PM,2021-05-13 01:58 PM,8476945,Connor Hellebuyck,Connor Hellebuyck will start Friday vs. Toronto https://t.co/El4SdFwimp
1392893813371277314,305746098,ICdave,2021-05-13 01:25 PM,2021-05-13 01:58 PM,8476945,Connor Hellebuyck,Connor Hellebuyck starts tomorrow night against the Leafs. The Jets netminder wants the game according to Paul Maurice. #NHLJets
1392899734633947139,2434140744,RotoWireNHL,2021-05-13 01:49 PM,2021-05-13 01:58 PM,8476945,Connor Hellebuyck,Connor Hellebuyck: Gets starting nod Friday https://t.co/6zFtBwPsug
1392897938561683459,3925722439,FantasyAlarmNHL,2021-05-13 01:42 PM,2021-05-13 01:58 PM,8476945,Connor Hellebuyck,Connor Hellebuyck will be between the pipes for Friday's regular-season finale against Toronto. Fantasy Analysis Here: https://t.co/BQGP4B09SE
