tweet_id,author_id,handle,created_at,found_at,goalie_id,goalie_name,text
1373291652509532164,23267939,Aportzline,2021-03-20 11:13 AM,2021-03-20 11:28 AM,8478007,Elvis Merzlikins,Only one change tonight for #CBJ vs. Carolina. G Elvis Merzlikins will start in nets.
1373294268584923141,20950481,NBCSEdgeHK,2021-03-20 11:24 AM,2021-03-20 11:28 AM,8478007,Elvis Merzlikins,Elvis Merzlikins to start on Saturday https://t.co/ngPWfGOZqc
1373292712267485189,2333632562,markscheig,2021-03-20 11:17 AM,2021-03-20 11:28 AM,8478007,Elvis Merzlikins,Merzlikins starts in CAR tonight. Same lineup otherwise. #CBJ
1373293758964498435,3925722439,FantasyAlarmNHL,2021-03-20 11:22 AM,2021-03-20 11:28 AM,8478007,Elvis Merzlikins,Elvis Merzlikins will get the start in goal for Columbus Saturday. Fantasy Analysis Here: https://t.co/d1xBBO2mNB
1373408728586842118,22016898,CanesOnFSCR,2021-03-20 06:58 PM,2021-03-20 07:14 PM,8478007,Elvis Merzlikins,TONIGHT'S GOALIES  -Merzlikins starts for #CBJ  -Optimus Reim is in for #LetsGoCanes @Canes | #CBJvsCAR  https://t.co/V6XXnVlz0b
